{
  "schema_version": 1,
  "kind": "client-decision",
  "description": "Engine reactions to PATCH and HEAD on an upload (sync-protocol.md §7.3, §8, R2, R5, R7, R11).",
  "cases": [
    { "name": "append_finalized", "given": { "flow": "backup", "item_state": "Uploading", "last_action": "append_upload", "item": { "kind": "photo", "has_upload_id": true } }, "server": { "status": 204, "headers": { "Upload-Offset": "1048576", "PicTunnel-Asset-Id": "01928f40-0000-7000-8000-000000000001", "PicTunnel-Asset-Created": "true" } }, "expect": { "next_state": "BackedUp", "action": "mark_backed_up", "attempts_delta": 0 } },
    { "name": "append_offset_mismatch", "given": { "flow": "backup", "item_state": "Uploading", "last_action": "append_upload", "item": { "kind": "video", "has_upload_id": true } }, "server": { "status": 409, "headers": { "Upload-Offset": "2097152" }, "problem": "offset_mismatch" }, "expect": { "next_state": "Uploading", "action": "head_then_resume", "attempts_delta": 0 } },
    { "name": "append_upload_locked", "given": { "flow": "backup", "item_state": "Uploading", "last_action": "append_upload", "item": { "kind": "video", "has_upload_id": true } }, "server": { "status": 423, "problem": "upload_locked" }, "expect": { "next_state": "Uploading", "action": "backoff_retry", "attempts_delta": 1 } },
    { "name": "append_checksum_mismatch", "given": { "flow": "backup", "item_state": "Uploading", "last_action": "append_upload", "item": { "kind": "photo", "has_upload_id": true } }, "server": { "status": 460, "problem": "checksum_mismatch" }, "expect": { "next_state": "Discovered", "action": "rehash_and_requeue", "attempts_delta": 1 } },
    { "name": "append_upload_not_found", "description": "The session expired; creating again is safe because creation is idempotent.", "given": { "flow": "backup", "item_state": "Uploading", "last_action": "append_upload", "item": { "kind": "video", "has_upload_id": true } }, "server": { "status": 404, "problem": "not_found" }, "expect": { "next_state": "Queued", "action": "restart_upload", "attempts_delta": 0 } },
    { "name": "append_reset_during_final_chunk", "description": "R2: the finalize may or may not have happened; ask with HEAD.", "given": { "flow": "backup", "item_state": "Uploading", "last_action": "append_upload", "item": { "kind": "photo", "has_upload_id": true } }, "server": { "transport": "reset" }, "expect": { "next_state": "Uploading", "action": "head_then_resume", "attempts_delta": 1 } },
    { "name": "append_rate_limited", "description": "Throttling is not the item's fault and does not count as an attempt.", "given": { "flow": "backup", "item_state": "Uploading", "last_action": "append_upload", "item": { "kind": "photo", "has_upload_id": true } }, "server": { "status": 429, "headers": { "Retry-After": "30" }, "problem": "rate_limited" }, "expect": { "next_state": "Uploading", "action": "wait_retry_after", "attempts_delta": 0 } },
    { "name": "append_server_unavailable", "given": { "flow": "backup", "item_state": "Uploading", "last_action": "append_upload", "item": { "kind": "photo", "has_upload_id": true } }, "server": { "status": 503, "headers": { "Retry-After": "60" }, "problem": "server_unavailable" }, "expect": { "next_state": "Uploading", "action": "wait_retry_after", "attempts_delta": 1 } },
    { "name": "append_internal_error", "given": { "flow": "backup", "item_state": "Uploading", "last_action": "append_upload", "item": { "kind": "photo", "has_upload_id": true } }, "server": { "status": 500, "problem": "internal" }, "expect": { "next_state": "Uploading", "action": "backoff_retry", "attempts_delta": 1 } },
    { "name": "append_offline", "given": { "flow": "backup", "item_state": "Uploading", "last_action": "append_upload", "item": { "kind": "photo", "has_upload_id": true } }, "server": { "transport": "offline" }, "expect": { "next_state": "Uploading", "action": "wait_for_network", "attempts_delta": 0 } },
    { "name": "append_token_expired", "given": { "flow": "backup", "item_state": "Uploading", "last_action": "append_upload", "item": { "kind": "photo", "has_upload_id": true } }, "server": { "status": 401, "problem": "token_expired" }, "expect": { "next_state": "Uploading", "action": "refresh_then_retry", "attempts_delta": 0 } },
    { "name": "append_unauthorized", "given": { "flow": "backup", "item_state": "Uploading", "last_action": "append_upload", "item": { "kind": "photo", "has_upload_id": true } }, "server": { "status": 401, "problem": "unauthorized" }, "expect": { "next_state": "Uploading", "action": "refresh_then_retry", "attempts_delta": 0 } },
    { "name": "append_forbidden", "given": { "flow": "backup", "item_state": "Uploading", "last_action": "append_upload", "item": { "kind": "photo", "has_upload_id": true } }, "server": { "status": 403, "problem": "forbidden" }, "expect": { "next_state": "NeedsAttention", "action": "mark_needs_attention", "attempts_delta": 0 } },
    { "name": "append_invalid_request", "given": { "flow": "backup", "item_state": "Uploading", "last_action": "append_upload", "item": { "kind": "photo", "has_upload_id": true } }, "server": { "status": 400, "problem": "invalid_request" }, "expect": { "next_state": "NeedsAttention", "action": "mark_needs_attention", "attempts_delta": 0 } },
    { "name": "append_unknown_4xx", "description": "R7: unknown 4xx statuses are not retried.", "given": { "flow": "backup", "item_state": "Uploading", "last_action": "append_upload", "item": { "kind": "photo", "has_upload_id": true } }, "server": { "status": 418, "problem": "teapot" }, "expect": { "next_state": "NeedsAttention", "action": "mark_needs_attention", "attempts_delta": 0 } },
    { "name": "append_unknown_5xx", "description": "R7: unknown 5xx statuses are retried with backoff.", "given": { "flow": "backup", "item_state": "Uploading", "last_action": "append_upload", "item": { "kind": "photo", "has_upload_id": true } }, "server": { "status": 599 }, "expect": { "next_state": "Uploading", "action": "backoff_retry", "attempts_delta": 1 } },
    { "name": "append_insufficient_storage", "given": { "flow": "backup", "item_state": "Uploading", "last_action": "append_upload", "item": { "kind": "video", "has_upload_id": true } }, "server": { "status": 507, "problem": "insufficient_storage" }, "expect": { "next_state": "Paused", "action": "pause_all_uploads", "attempts_delta": 0 } },
    { "name": "head_timeout", "given": { "flow": "backup", "item_state": "Uploading", "last_action": "head_upload", "item": { "kind": "video", "has_upload_id": true } }, "server": { "transport": "timeout" }, "expect": { "next_state": "Uploading", "action": "backoff_retry", "attempts_delta": 1 } },
    { "name": "head_reports_finalized", "given": { "flow": "backup", "item_state": "Uploading", "last_action": "head_upload", "item": { "kind": "photo", "has_upload_id": true } }, "server": { "status": 200, "headers": { "Upload-Offset": "1048576", "Upload-Length": "1048576", "PicTunnel-Asset-Id": "01928f40-0000-7000-8000-000000000001" } }, "expect": { "next_state": "BackedUp", "action": "mark_backed_up", "attempts_delta": 0 } }
  ]
}