{
  "schema_version": 1,
  "kind": "client-decision",
  "description": "Engine reactions to POST /uploads (sync-protocol.md §7.3).",
  "cases": [
    { "name": "create_timeout_unknown_outcome", "description": "R2: without an upload id the engine re-checks instead of guessing.", "given": { "flow": "backup", "item_state": "Queued", "last_action": "create_upload", "item": { "kind": "photo", "has_upload_id": false } }, "server": { "transport": "timeout" }, "expect": { "next_state": "Hashed", "action": "check_then_resolve", "attempts_delta": 1 } },
    { "name": "create_resolved_to_existing_asset", "given": { "flow": "backup", "item_state": "Queued", "last_action": "create_upload", "item": { "kind": "photo" } }, "server": { "status": 201, "headers": { "Location": "/api/v1/uploads/a_01928f40", "Upload-Offset": "1048576", "PicTunnel-Asset-Id": "01928f40-0000-7000-8000-000000000001", "PicTunnel-Asset-Created": "false" } }, "expect": { "next_state": "BackedUp", "action": "mark_backed_up", "attempts_delta": 0 } },
    { "name": "create_session_returned", "given": { "flow": "backup", "item_state": "Queued", "last_action": "create_upload", "item": { "kind": "video" } }, "server": { "status": 201, "headers": { "Location": "/api/v1/uploads/u1", "Upload-Offset": "0" } }, "expect": { "next_state": "Uploading", "action": "resume_upload", "attempts_delta": 0 } },
    { "name": "create_tombstoned", "given": { "flow": "backup", "item_state": "Queued", "last_action": "create_upload", "item": { "kind": "photo" } }, "server": { "status": 409, "problem": "tombstoned" }, "expect": { "next_state": "Skipped", "action": "mark_skipped", "attempts_delta": 0 } },
    { "name": "create_length_mismatch", "description": "The cached hash or size is stale; re-hash the file.", "given": { "flow": "backup", "item_state": "Queued", "last_action": "create_upload", "item": { "kind": "photo" } }, "server": { "status": 409, "problem": "length_mismatch" }, "expect": { "next_state": "Discovered", "action": "rehash_and_requeue", "attempts_delta": 1 } },
    { "name": "create_pair_primary_missing", "given": { "flow": "backup", "item_state": "Queued", "last_action": "create_upload", "item": { "kind": "live_photo" } }, "server": { "status": 409, "problem": "pair_primary_missing" }, "expect": { "next_state": "Queued", "action": "upload_primary_first", "attempts_delta": 0 } },
    { "name": "create_file_too_large", "given": { "flow": "backup", "item_state": "Queued", "last_action": "create_upload", "item": { "kind": "video" } }, "server": { "status": 413, "problem": "file_too_large" }, "expect": { "next_state": "NeedsAttention", "action": "mark_needs_attention", "attempts_delta": 0 } },
    { "name": "create_quota_exceeded", "given": { "flow": "backup", "item_state": "Queued", "last_action": "create_upload", "item": { "kind": "photo" } }, "server": { "status": 413, "problem": "quota_exceeded" }, "expect": { "next_state": "Paused", "action": "notify_quota", "attempts_delta": 0 } },
    { "name": "create_insufficient_storage", "given": { "flow": "backup", "item_state": "Queued", "last_action": "create_upload", "item": { "kind": "photo" } }, "server": { "status": 507, "problem": "insufficient_storage" }, "expect": { "next_state": "Paused", "action": "pause_all_uploads", "attempts_delta": 0 } },
    { "name": "create_client_too_old", "given": { "flow": "backup", "item_state": "Queued", "last_action": "create_upload", "item": { "kind": "photo" } }, "server": { "status": 426, "problem": "client_too_old" }, "expect": { "next_state": "Paused", "action": "prompt_update", "attempts_delta": 0 } },
    { "name": "create_checksum_mismatch_single_shot", "given": { "flow": "backup", "item_state": "Queued", "last_action": "create_upload", "item": { "kind": "photo" } }, "server": { "status": 460, "problem": "checksum_mismatch" }, "expect": { "next_state": "Discovered", "action": "rehash_and_requeue", "attempts_delta": 1 } }
  ]
}