{
  "schema_version": 1,
  "kind": "client-decision",
  "description": "Engine reactions to /sync/check results (sync-protocol.md §7.2, R2, R5, R7).",
  "cases": [
    { "name": "check_exists_active", "given": { "flow": "backup", "item_state": "Hashed", "last_action": "check", "item": { "kind": "photo" } }, "server": { "status": 200, "json": { "results": [{ "sha256": "fbbab289f7f94b25736c58be46a994c441fd02552cc6022352e3d86d2fab7c83", "verdict": "exists", "asset_id": "01928f40-0000-7000-8000-000000000001", "asset_state": "active" }] } }, "expect": { "next_state": "BackedUp", "action": "mark_backed_up", "attempts_delta": 0 } },
    { "name": "check_exists_trashed", "description": "Content in the server trash counts as backed up.", "given": { "flow": "backup", "item_state": "Hashed", "last_action": "check", "item": { "kind": "photo" } }, "server": { "status": 200, "json": { "results": [{ "sha256": "fbbab289f7f94b25736c58be46a994c441fd02552cc6022352e3d86d2fab7c83", "verdict": "exists", "asset_id": "01928f40-0000-7000-8000-000000000001", "asset_state": "trashed" }] } }, "expect": { "next_state": "BackedUp", "action": "mark_backed_up", "attempts_delta": 0 } },
    { "name": "check_missing", "given": { "flow": "backup", "item_state": "Hashed", "last_action": "check", "item": { "kind": "photo" } }, "server": { "status": 200, "json": { "results": [{ "sha256": "fbbab289f7f94b25736c58be46a994c441fd02552cc6022352e3d86d2fab7c83", "verdict": "missing" }] } }, "expect": { "next_state": "Queued", "action": "queue_upload", "attempts_delta": 0 } },
    { "name": "check_partial", "given": { "flow": "backup", "item_state": "Hashed", "last_action": "check", "item": { "kind": "video" } }, "server": { "status": 200, "json": { "results": [{ "sha256": "f6dd7fec8584ad00219a447071c1fa368a1caee4d9c146083d233713ddccd2c0", "verdict": "partial", "upload": { "id": "u1", "url": "/api/v1/uploads/u1", "offset": 1048576, "length": 3145728, "expires_at": "2026-10-04T12:00:00Z" } }] } }, "expect": { "next_state": "Uploading", "action": "resume_upload", "attempts_delta": 0 } },
    { "name": "check_tombstoned", "given": { "flow": "backup", "item_state": "Hashed", "last_action": "check", "item": { "kind": "photo" } }, "server": { "status": 200, "json": { "results": [{ "sha256": "fbbab289f7f94b25736c58be46a994c441fd02552cc6022352e3d86d2fab7c83", "verdict": "tombstoned", "deleted_at": "2026-09-01T08:00:00Z" }] } }, "expect": { "next_state": "Skipped", "action": "mark_skipped", "attempts_delta": 0 } },
    { "name": "check_unknown_verdict", "description": "R7: unknown verdicts are skipped for this run, not treated as errors.", "given": { "flow": "backup", "item_state": "Hashed", "last_action": "check", "item": { "kind": "photo" } }, "server": { "status": 200, "json": { "results": [{ "sha256": "fbbab289f7f94b25736c58be46a994c441fd02552cc6022352e3d86d2fab7c83", "verdict": "archived_cold" }] } }, "expect": { "next_state": "Hashed", "action": "skip_this_run", "attempts_delta": 0 } },
    { "name": "check_live_photo_missing_video", "description": "H4: the still exists but its video component never arrived.", "given": { "flow": "backup", "item_state": "Hashed", "last_action": "check", "item": { "kind": "live_photo" } }, "server": { "status": 200, "json": { "results": [{ "sha256": "fbbab289f7f94b25736c58be46a994c441fd02552cc6022352e3d86d2fab7c83", "verdict": "exists", "asset_id": "01928f40-0000-7000-8000-000000000001", "asset_state": "active", "has_live_video": false }] } }, "expect": { "next_state": "Queued", "action": "upload_live_video", "attempts_delta": 0 } },
    { "name": "check_timeout", "given": { "flow": "backup", "item_state": "Hashed", "last_action": "check", "item": { "kind": "photo", "attempts": 0 } }, "server": { "transport": "timeout" }, "expect": { "next_state": "Hashed", "action": "backoff_retry", "attempts_delta": 1 } },
    { "name": "check_offline", "description": "R5: no network does not count as an attempt.", "given": { "flow": "backup", "item_state": "Hashed", "last_action": "check", "item": { "kind": "photo", "attempts": 0 } }, "server": { "transport": "offline" }, "expect": { "next_state": "Hashed", "action": "wait_for_network", "attempts_delta": 0 } }
  ]
}