{
  "schema_version": 1,
  "kind": "client-decision",
  "description": "Free-up-space preconditions (sync-protocol.md §7.8, R8). The check was sent with confirm_on_disk=true.",
  "cases": [
    { "name": "free_space_confirmed", "given": { "flow": "free_up_space", "item_state": "BackedUp", "last_action": "free_up_space_check", "item": { "kind": "photo", "fingerprint_changed": false } }, "server": { "status": 200, "json": { "results": [{ "sha256": "fbbab289f7f94b25736c58be46a994c441fd02552cc6022352e3d86d2fab7c83", "verdict": "exists", "asset_id": "01928f40-0000-7000-8000-000000000001", "asset_state": "active", "on_disk": true }] } }, "expect": { "next_state": "Freed", "action": "delete_local_allowed", "attempts_delta": 0 } },
    { "name": "free_space_asset_trashed", "given": { "flow": "free_up_space", "item_state": "BackedUp", "last_action": "free_up_space_check", "item": { "kind": "photo", "fingerprint_changed": false } }, "server": { "status": 200, "json": { "results": [{ "sha256": "fbbab289f7f94b25736c58be46a994c441fd02552cc6022352e3d86d2fab7c83", "verdict": "exists", "asset_id": "01928f40-0000-7000-8000-000000000001", "asset_state": "trashed", "on_disk": true }] } }, "expect": { "next_state": "BackedUp", "action": "delete_local_denied", "attempts_delta": 0 } },
    { "name": "free_space_not_on_disk", "given": { "flow": "free_up_space", "item_state": "BackedUp", "last_action": "free_up_space_check", "item": { "kind": "photo", "fingerprint_changed": false } }, "server": { "status": 200, "json": { "results": [{ "sha256": "fbbab289f7f94b25736c58be46a994c441fd02552cc6022352e3d86d2fab7c83", "verdict": "exists", "asset_id": "01928f40-0000-7000-8000-000000000001", "asset_state": "active", "on_disk": false }] } }, "expect": { "next_state": "BackedUp", "action": "delete_local_denied", "attempts_delta": 0 } },
    { "name": "free_space_fingerprint_changed", "description": "The local file changed since it was hashed, so the server copy may differ.", "given": { "flow": "free_up_space", "item_state": "BackedUp", "last_action": "free_up_space_check", "item": { "kind": "photo", "fingerprint_changed": true } }, "server": { "status": 200, "json": { "results": [{ "sha256": "fbbab289f7f94b25736c58be46a994c441fd02552cc6022352e3d86d2fab7c83", "verdict": "exists", "asset_id": "01928f40-0000-7000-8000-000000000001", "asset_state": "active", "on_disk": true }] } }, "expect": { "next_state": "Discovered", "action": "delete_local_denied", "attempts_delta": 0 } },
    { "name": "free_space_missing_on_server", "given": { "flow": "free_up_space", "item_state": "BackedUp", "last_action": "free_up_space_check", "item": { "kind": "photo", "fingerprint_changed": false } }, "server": { "status": 200, "json": { "results": [{ "sha256": "fbbab289f7f94b25736c58be46a994c441fd02552cc6022352e3d86d2fab7c83", "verdict": "missing" }] } }, "expect": { "next_state": "Queued", "action": "delete_local_denied", "attempts_delta": 0 } }
  ]
}