{
  "schema_version": 1,
  "kind": "server-scenario",
  "description": "Check side effects, snapshot plus change feed, cursor rules (sync-protocol.md §7.2, §7.6).",
  "cases": [
    {
      "name": "check_links_sources",
      "description": "An exists verdict links the caller's local_id to the asset, idempotently.",
      "actors": { "device_a": { "user": "alice", "platform": "android" }, "device_b": { "user": "alice", "platform": "ios" } },
      "steps": [
        {
          "actor": "device_a",
          "request": {
            "method": "POST", "path": "/api/v1/uploads",
            "headers": { "Tus-Resumable": "1.0.0", "Upload-Length": "1048576", "Content-Type": "application/offset+octet-stream" },
            "tus_metadata": { "sha256": "fbbab289f7f94b25736c58be46a994c441fd02552cc6022352e3d86d2fab7c83", "filename": "IMG_0001.JPG", "mime": "image/jpeg", "local_id": "a-1" },
            "body": { "generate": { "pattern": "counter", "seed": 0, "length": 1048576 } }
          },
          "expect": { "status": 201 },
          "save": { "asset": "header:PicTunnel-Asset-Id" }
        },
        {
          "actor": "device_b",
          "request": { "method": "POST", "path": "/api/v1/sync/check", "json": { "items": [{ "sha256": "fbbab289f7f94b25736c58be46a994c441fd02552cc6022352e3d86d2fab7c83", "size_bytes": 1048576, "local_id": "b-7" }] } },
          "expect": { "status": 200, "body": { "results": [{ "verdict": "exists", "asset_id": "${asset}" }] } }
        },
        {
          "control": { "assert_asset_sources": { "asset": "${asset}", "sources": [{ "actor": "device_a", "local_id": "a-1" }, { "actor": "device_b", "local_id": "b-7" }] } }
        },
        {
          "actor": "device_b",
          "request": { "method": "POST", "path": "/api/v1/sync/check", "json": { "items": [{ "sha256": "fbbab289f7f94b25736c58be46a994c441fd02552cc6022352e3d86d2fab7c83", "size_bytes": 1048576, "local_id": "b-7" }] } },
          "expect": { "status": 200, "body": { "results": [{ "verdict": "exists", "asset_id": "${asset}" }] } }
        },
        {
          "control": { "assert_asset_sources": { "asset": "${asset}", "sources": [{ "actor": "device_a", "local_id": "a-1" }, { "actor": "device_b", "local_id": "b-7" }] } }
        }
      ]
    },
    {
      "name": "snapshot_changes_overlap",
      "description": "Changes made after a snapshot are delivered by the feed from the snapshot cursor.",
      "actors": { "device_a": { "user": "alice", "platform": "android" } },
      "steps": [
        {
          "actor": "device_a",
          "request": {
            "method": "POST", "path": "/api/v1/uploads",
            "headers": { "Tus-Resumable": "1.0.0", "Upload-Length": "1048576", "Content-Type": "application/offset+octet-stream" },
            "tus_metadata": { "sha256": "fbbab289f7f94b25736c58be46a994c441fd02552cc6022352e3d86d2fab7c83", "filename": "IMG_0001.JPG", "mime": "image/jpeg" },
            "body": { "generate": { "pattern": "counter", "seed": 0, "length": 1048576 } }
          },
          "expect": { "status": 201 },
          "save": { "asset_a": "header:PicTunnel-Asset-Id" }
        },
        {
          "actor": "device_a",
          "request": { "method": "GET", "path": "/api/v1/sync/snapshot" },
          "expect": { "status": 200, "body": { "cursor": "$any", "assets": [{ "id": "${asset_a}" }], "has_more": false } },
          "save": { "cursor": "body:/cursor" }
        },
        {
          "actor": "device_a",
          "request": {
            "method": "POST", "path": "/api/v1/uploads",
            "headers": { "Tus-Resumable": "1.0.0", "Upload-Length": "1048576", "Content-Type": "application/offset+octet-stream" },
            "tus_metadata": { "sha256": "18af9b054114c04a1eb836533a3e760dfa9dc53934ecb02fc059ff27150e77fb", "filename": "IMG_0002.JPG", "mime": "image/jpeg" },
            "body": { "generate": { "pattern": "counter", "seed": 1, "length": 1048576 } }
          },
          "expect": { "status": 201 },
          "save": { "asset_b": "header:PicTunnel-Asset-Id" }
        },
        {
          "actor": "device_a",
          "request": { "method": "POST", "path": "/api/v1/assets/trash", "json": { "asset_ids": ["${asset_a}"] } },
          "expect": { "status": 200 }
        },
        {
          "actor": "device_a",
          "request": { "method": "GET", "path": "/api/v1/sync/changes?cursor=${cursor}" },
          "expect": {
            "status": 200,
            "body": {
              "changes": [
                { "kind": "asset.upsert", "asset": { "id": "${asset_b}", "state": "active" } },
                { "kind": "asset.upsert", "asset": { "id": "${asset_a}", "state": "trashed" } }
              ],
              "has_more": false
            }
          }
        }
      ]
    },
    {
      "name": "cursor_expired_requires_snapshot",
      "description": "A cursor older than the 90-day retention is rejected with 410.",
      "actors": { "device_a": { "user": "alice", "platform": "android" } },
      "steps": [
        {
          "actor": "device_a",
          "request": {
            "method": "POST", "path": "/api/v1/uploads",
            "headers": { "Tus-Resumable": "1.0.0", "Upload-Length": "1048576", "Content-Type": "application/offset+octet-stream" },
            "tus_metadata": { "sha256": "fbbab289f7f94b25736c58be46a994c441fd02552cc6022352e3d86d2fab7c83", "filename": "IMG_0001.JPG", "mime": "image/jpeg" },
            "body": { "generate": { "pattern": "counter", "seed": 0, "length": 1048576 } }
          },
          "expect": { "status": 201 }
        },
        {
          "actor": "device_a",
          "request": { "method": "GET", "path": "/api/v1/sync/snapshot" },
          "expect": { "status": 200 },
          "save": { "cursor": "body:/cursor" }
        },
        { "control": { "advance_clock_seconds": 7862400 } },
        { "control": { "run_job": "compact_change_log" } },
        {
          "actor": "device_a",
          "request": { "method": "GET", "path": "/api/v1/sync/changes?cursor=${cursor}" },
          "expect": { "status": 410, "body": { "code": "cursor_expired" } }
        }
      ]
    },
    {
      "name": "changes_without_cursor_rejected",
      "description": "The feed requires a cursor so clients always start from a snapshot.",
      "actors": { "device_a": { "user": "alice", "platform": "web" } },
      "steps": [
        {
          "actor": "device_a",
          "request": { "method": "GET", "path": "/api/v1/sync/changes" },
          "expect": { "status": 400, "body": { "code": "cursor_required" } }
        }
      ]
    }
  ]
}